,station,region,region_code,location,coordinates,latitude,longitude
199,Шолаккорган,Туркестанская область,KZ-YUZ,"Шолаккорган, Туркестанская область, Казахстан","Шолаққорған, Созақ ауданы, Түркістан облысы, 161000, Қазақстан",43.766701,69.17688
200,Шуылдак,Туркестанская область,KZ-YUZ,"Шуылдак, Туркестанская область, Казахстан",,,
201,Шымкент,Туркестанская область,KZ-YUZ,"Шымкент, Туркестанская область, Казахстан","Шымкент, Көлкент, Сайрам ауданы, Түркістан облысы, 160808, Қазақстан",42.32188194264865,69.58885464824581
202,Аксай,Западно-Казахстанская область,KZ-ZAP,"Аксай, Западно-Казахстанская область, Казахстан","Аксай, Бөрлі ауданы, Батыс Қазақстан облысы, Қазақстан",51.173893,53.011478
203,Джамбейты,Западно-Казахстанская область,KZ-ZAP,"Джамбейты, Западно-Казахстанская область, Казахстан",,50.26055173,52.60195228
204,Джангала,Западно-Казахстанская область,KZ-ZAP,"Джангала, Западно-Казахстанская область, Казахстан",,49.2142027,50.30167586
205,Джаныбек,Западно-Казахстанская область,KZ-ZAP,"Джаныбек, Западно-Казахстанская область, Казахстан",,49.42126899,46.84634692
206,Жалпактал,Западно-Казахстанская область,KZ-ZAP,"Жалпактал, Западно-Казахстанская область, Казахстан","Жалпактал, Казталов ауданы, Батыс Қазақстан облысы, Қазақстан",49.670628,49.473915
207,Каменка,Западно-Казахстанская область,KZ-ZAP,"Каменка, Западно-Казахстанская область, Казахстан","Тасқала, Тасқала ауданы, Батыс Қазақстан облысы, 091000, Қазақстан",51.106861,50.291088
208,Каратюба,Западно-Казахстанская область,KZ-ZAP,"Каратюба, Западно-Казахстанская область, Казахстан",,49.6911732,53.51097086
209,Тайпак,Западно-Казахстанская область,KZ-ZAP,"Тайпак, Западно-Казахстанская область, Казахстан","Тайпақ, Ақжайық ауданы, Батыс Қазақстан облысы, Қазақстан",49.037285,51.830154
210,Уральск,Западно-Казахстанская область,KZ-ZAP,"Уральск, Западно-Казахстанская область, Казахстан","Орал Қ.Ә., Батыс Қазақстан облысы, Қазақстан",51.2040697,51.3707863
211,Урда,Западно-Казахстанская область,KZ-ZAP,"Урда, Западно-Казахстанская область, Казахстан","Хан Ордасы, Бокейординский район - Бөкей Орда ауданы, Батыс Қазақстан облысы, Қазақстан",48.769749,47.430492
212,Чапаево,Западно-Казахстанская область,KZ-ZAP,"Чапаево, Западно-Казахстанская область, Казахстан","157, Жанибек - Чапаев, Казталов ауданы, Батыс Қазақстан облысы, Қазақстан",50.17742771190655,51.168484315420905
213,Чингирлау,Западно-Казахстанская область,KZ-ZAP,"Чингирлау, Западно-Казахстанская область, Казахстан","Шыңғырлау, Шыңғырлау ауданы, Батыс Қазақстан облысы, 091200, Қазақстан",51.100506,54.085167
214,Январцево,Западно-Казахстанская область,KZ-ZAP,"Январцево, Западно-Казахстанская область, Казахстан","Январцево, Зеленов ауданы, Батыс Қазақстан облысы, Қазақстан",51.443405,52.247547
215,Жанатас,Жамбылская область,KZ-ZHA,"Жанатас, Жамбылская область, Казахстан","Жаңатас, Сарысу ауданы, Жамбыл облысы, 080700, Қазақстан",43.5567547,69.7265539
216,Каратау,Жамбылская область,KZ-ZHA,"Каратау, Жамбылская область, Казахстан","Қаратау, Талас ауданы, Жамбыл облысы, Қазақстан",43.176197,70.46489
217,Кордай,Жамбылская область,KZ-ZHA,"Кордай, Жамбылская область, Казахстан","Қордай, Қордай ауданы, Жамбыл облысы, 080400, Қазақстан",43.042965,74.714485
218,Кулан,Жамбылская область,KZ-ZHA,"Кулан, Жамбылская область, Казахстан","Құлан, Тұрар Рысқұлов ауданы, Жамбыл облысы, Қазақстан",42.910576,72.715652
219,Мерке,Жамбылская область,KZ-ZHA,"Мерке, Жамбылская область, Казахстан","Меркі, Меркі ауданы, Жамбыл облысы, Қазақстан",42.8713714,73.1738583
220,Мойынкум,Жамбылская область,KZ-ZHA,"Мойынкум, Жамбылская область, Казахстан","Мойынқұм, Мойынқұм ауданы, Жамбыл облысы, Қазақстан",44.28545,72.94297
221,Саудакент,Жамбылская область,KZ-ZHA,"Саудакент, Жамбылская область, Казахстан","Саудакент, Сарысу ауданы, Жамбыл облысы, Қазақстан",43.735256,69.924622
222,Тараз,Жамбылская область,KZ-ZHA,"Тараз, Жамбылская область, Казахстан","Тараз, Тараз Қ.Ә., Жамбыл облысы, 080000, Қазақстан",42.9015945,71.3769302
223,Толе би,Жамбылская область,KZ-ZHA,"Толе би, Жамбылская область, Казахстан","Төле би, Шу ауданы, Жамбыл облысы, Қазақстан",43.681767,73.762444
224,Уюк,Жамбылская область,KZ-ZHA,"Уюк, Жамбылская область, Казахстан","Ойық, Талас ауданы, Жамбыл облысы, Қазақстан",43.781734,70.955589
225,Хантау,Жамбылская область,KZ-ZHA,"Хантау, Жамбылская область, Казахстан","Хантау, Мойынқұм ауданы, Жамбыл облысы, Қазақстан",44.226612,73.795189
226,Чиганак,Жамбылская область,KZ-ZHA,"Чиганак, Жамбылская область, Казахстан","Шығанақ, Мойынқұм ауданы, Жамбыл облысы, Қазақстан",45.1064432,73.975037
227,Шокпар,Жамбылская область,KZ-ZHA,"Шокпар, Жамбылская область, Казахстан","Шоқпар, Шу ауданы, Жамбыл облысы, Қазақстан",43.825256,74.378639
